InvoiceNo,StockCode,Description,Quantity,InvoiceDate,UnitPrice,CustomerID,Country
580675,23343,JUMBO BAG VINTAGE CHRISTMAS ,10,05-12-2011 14:35,2.08,15640,United Kingdom
580675,20718,RED RETROSPOT SHOPPER BAG,10,05-12-2011 14:35,1.25,15640,United Kingdom
580675,22910,PAPER CHAIN KIT VINTAGE CHRISTMAS,12,05-12-2011 14:35,2.95,15640,United Kingdom
580675,22086,PAPER CHAIN KIT 50'S CHRISTMAS ,12,05-12-2011 14:35,2.95,15640,United Kingdom
580675,22109,FULL ENGLISH BREAKFAST PLATE,16,05-12-2011 14:35,3.39,15640,United Kingdom
580675,21843,RED RETROSPOT CAKE STAND,24,05-12-2011 14:35,9.95,15640,United Kingdom
580675,21871,SAVE THE PLANET MUG,12,05-12-2011 14:35,1.65,15640,United Kingdom
580675,21877,HOME SWEET HOME MUG,12,05-12-2011 14:35,1.65,15640,United Kingdom
580675,23439,HAND WARMER RED LOVE HEART,12,05-12-2011 14:35,2.1,15640,United Kingdom
580675,22834,HAND WARMER BABUSHKA DESIGN,12,05-12-2011 14:35,2.1,15640,United Kingdom
580675,22865,HAND WARMER OWL DESIGN,12,05-12-2011 14:35,2.1,15640,United Kingdom
580675,22866,HAND WARMER SCOTTY DOG DESIGN,12,05-12-2011 14:35,2.1,15640,United Kingdom
580675,22867,HAND WARMER BIRD DESIGN,12,05-12-2011 14:35,2.1,15640,United Kingdom
580675,22111,SCOTTIE DOG HOT WATER BOTTLE,6,05-12-2011 14:35,4.95,15640,United Kingdom
580675,23356,LOVE HOT WATER BOTTLE,6,05-12-2011 14:35,5.95,15640,United Kingdom
580675,84077,WORLD WAR 2 GLIDERS ASSTD DESIGNS,96,05-12-2011 14:35,0.29,15640,United Kingdom
580675,21210,SET OF 72 RETROSPOT PAPER  DOILIES,12,05-12-2011 14:35,1.45,15640,United Kingdom
580675,22952,60 CAKE CASES VINTAGE CHRISTMAS,24,05-12-2011 14:35,0.55,15640,United Kingdom
580675,84692,BOX OF 24 COCKTAIL PARASOLS,50,05-12-2011 14:35,0.42,15640,United Kingdom
580675,84992,72 SWEETHEART FAIRY CAKE CASES,24,05-12-2011 14:35,0.55,15640,United Kingdom
580675,23122,PARTY CHARMS 50 PIECES,12,05-12-2011 14:35,0.83,15640,United Kingdom
580675,22667,RECIPE BOX RETROSPOT ,6,05-12-2011 14:35,2.95,15640,United Kingdom
580675,23382,BOX OF 6 CHRISTMAS CAKE DECORATIONS,8,05-12-2011 14:35,3.75,15640,United Kingdom
580675,23582,VINTAGE DOILY JUMBO BAG RED ,10,05-12-2011 14:35,2.08,15640,United Kingdom
580675,23101,SILVER STARS TABLE DECORATION,12,05-12-2011 14:35,0.83,15640,United Kingdom
580675,23583,LUNCH BAG PAISLEY PARK  ,10,05-12-2011 14:35,1.65,15640,United Kingdom
580675,23493,VINTAGE DOILY TRAVEL SEWING KIT,10,05-12-2011 14:35,1.95,15640,United Kingdom
580675,23598,PAPER BUNTING VINTAGE PARTY,12,05-12-2011 14:35,2.95,15640,United Kingdom
580675,23247,BISCUIT TIN 50'S CHRISTMAS,6,05-12-2011 14:35,2.89,15640,United Kingdom
580675,23234,BISCUIT TIN VINTAGE CHRISTMAS,6,05-12-2011 14:35,2.89,15640,United Kingdom
580675,23560,SET OF 6 RIBBONS COUNTRY STYLE,12,05-12-2011 14:35,2.89,15640,United Kingdom
580675,23562,SET OF 6 RIBBONS PERFECTLY PRETTY  ,12,05-12-2011 14:35,2.89,15640,United Kingdom
580675,23561,SET OF 6 RIBBONS PARTY,12,05-12-2011 14:35,2.89,15640,United Kingdom
580676,23472, NINE DRAWER OFFICE TIDY,3,05-12-2011 14:39,14.95,17817,United Kingdom
580676,23460,SWEETHEART WALL TIDY ,1,05-12-2011 14:39,9.95,17817,United Kingdom
580676,22155,STAR DECORATION RUSTIC,3,05-12-2011 14:39,0.42,17817,United Kingdom
580676,35961,FOLKART ZINC HEART CHRISTMAS DEC,3,05-12-2011 14:39,0.85,17817,United Kingdom
580676,23215,JINGLE BELL HEART ANTIQUE SILVER,3,05-12-2011 14:39,2.08,17817,United Kingdom
580676,20794,BLUE  TILE HOOK,1,05-12-2011 14:39,2.55,17817,United Kingdom
580676,23513,EMBROIDERED RIBBON REEL SUSIE ,2,05-12-2011 14:39,2.08,17817,United Kingdom
580676,22970,LONDON BUS COFFEE MUG,1,05-12-2011 14:39,2.55,17817,United Kingdom
580676,23116,VEGETABLE GARDEN CHOPPING BOARD,1,05-12-2011 14:39,4.95,17817,United Kingdom
580676,23576,SNACK TRAY RED VINTAGE DOILY,2,05-12-2011 14:39,1.95,17817,United Kingdom
580676,23293,SET OF 12 FAIRY CAKE BAKING CASES,1,05-12-2011 14:39,0.83,17817,United Kingdom
580676,23497,CLASSIC CHROME BICYCLE BELL ,1,05-12-2011 14:39,1.45,17817,United Kingdom
580676,23498,CLASSIC BICYCLE CLIPS ,1,05-12-2011 14:39,1.45,17817,United Kingdom
580676,84947,ANTIQUE SILVER TEA GLASS ENGRAVED,6,05-12-2011 14:39,1.25,17817,United Kingdom
580676,23338,EGG FRYING PAN RED ,1,05-12-2011 14:39,2.08,17817,United Kingdom
580676,22474,SPACEBOY TV DINNER TRAY,1,05-12-2011 14:39,1.95,17817,United Kingdom
580676,22473,TV DINNER TRAY VINTAGE PAISLEY,3,05-12-2011 14:39,1.95,17817,United Kingdom
580676,22696,WICKER WREATH LARGE,5,05-12-2011 14:39,1.95,17817,United Kingdom
580676,22411,JUMBO SHOPPER VINTAGE RED PAISLEY,1,05-12-2011 14:39,2.08,17817,United Kingdom
580676,23581,JUMBO BAG PAISLEY PARK,1,05-12-2011 14:39,2.08,17817,United Kingdom
580677,85034C,3 ROSE MORRIS BOXED CANDLES,1,05-12-2011 14:40,1.25,16200,United Kingdom
580677,22055,MINI CAKE STAND  HANGING STRAWBERY,1,05-12-2011 14:40,0.39,16200,United Kingdom
580677,84991,60 TEATIME FAIRY CAKE CASES,1,05-12-2011 14:40,0.55,16200,United Kingdom
580677,23210,WHITE ROCKING HORSE HAND PAINTED,1,05-12-2011 14:40,1.25,16200,United Kingdom
580677,22581,WOOD STOCKING CHRISTMAS SCANDISPOT,2,05-12-2011 14:40,0.29,16200,United Kingdom
580677,22577,WOODEN HEART CHRISTMAS SCANDINAVIAN,1,05-12-2011 14:40,0.29,16200,United Kingdom
580677,22578,WOODEN STAR CHRISTMAS SCANDINAVIAN,4,05-12-2011 14:40,0.29,16200,United Kingdom
580677,85114B,IVORY ENCHANTED FOREST PLACEMAT,1,05-12-2011 14:40,1.65,16200,United Kingdom
580677,85114C,RED ENCHANTED FOREST PLACEMAT,1,05-12-2011 14:40,1.65,16200,United Kingdom
580677,21429,RED GINGHAM ROSE JEWELLERY BOX,2,05-12-2011 14:40,1.95,16200,United Kingdom
580677,23312,VINTAGE CHRISTMAS GIFT SACK,1,05-12-2011 14:40,4.15,16200,United Kingdom
580677,84987,SET OF 36 TEATIME PAPER DOILIES,1,05-12-2011 14:40,1.45,16200,United Kingdom
580677,22733,3D TRADITIONAL CHRISTMAS STICKERS,1,05-12-2011 14:40,1.25,16200,United Kingdom
580677,22627,MINT KITCHEN SCALES,1,05-12-2011 14:40,8.5,16200,United Kingdom
580677,22731,3D CHRISTMAS STAMPS STICKERS ,1,05-12-2011 14:40,1.25,16200,United Kingdom
580677,85034C,3 ROSE MORRIS BOXED CANDLES,1,05-12-2011 14:40,1.25,16200,United Kingdom
580677,22882,NUMBER TILE VINTAGE FONT 3,1,05-12-2011 14:40,1.95,16200,United Kingdom
580677,22887,NUMBER TILE VINTAGE FONT 8,1,05-12-2011 14:40,1.95,16200,United Kingdom
580677,23459,DOLLY CABINET 2 DRAWERS ,1,05-12-2011 14:40,12.5,16200,United Kingdom
580677,21034,REX CASH+CARRY JUMBO SHOPPER,1,05-12-2011 14:40,0.95,16200,United Kingdom
580677,23334,IVORY WICKER HEART SMALL,1,05-12-2011 14:40,0.63,16200,United Kingdom
580677,23331,DECORATIVE WICKER HEART SMALL,1,05-12-2011 14:40,0.63,16200,United Kingdom
580678,16237,SLEEPING CAT ERASERS,1,05-12-2011 14:49,0.21,18015,United Kingdom
580678,16236,KITTY PENCIL ERASERS,1,05-12-2011 14:49,0.21,18015,United Kingdom
580678,16238,PARTY TIME PENCIL ERASERS,1,05-12-2011 14:49,0.21,18015,United Kingdom
580678,23500,KEY RING BASEBALL BOOT ASSORTED ,1,05-12-2011 14:49,1.25,18015,United Kingdom
580678,23501,KEY RING BASEBALL BOOT UNION JACK,1,05-12-2011 14:49,1.25,18015,United Kingdom
580678,21819,GLITTER CHRISTMAS STAR ,11,05-12-2011 14:49,0.39,18015,United Kingdom
580678,21818,GLITTER HEART DECORATION,10,05-12-2011 14:49,0.39,18015,United Kingdom
580678,22990,COTTON APRON PANTRY DESIGN,1,05-12-2011 14:49,1.95,18015,United Kingdom
580678,22367,CHILDRENS APRON SPACEBOY DESIGN,1,05-12-2011 14:49,1.95,18015,United Kingdom
580678,47591D,PINK FAIRY CAKE CHILDRENS APRON,1,05-12-2011 14:49,1.95,18015,United Kingdom
580678,47559B,TEA TIME OVEN GLOVE,2,05-12-2011 14:49,1.25,18015,United Kingdom
580678,22964,3 PIECE SPACEBOY COOKIE CUTTER SET,1,05-12-2011 14:49,2.1,18015,United Kingdom
580678,21946,PARTY TIME DESIGN FLANNEL,5,05-12-2011 14:49,0.39,18015,United Kingdom
580678,21942,SKULLS DESIGN FLANNEL,5,05-12-2011 14:49,0.39,18015,United Kingdom
580678,22955,36 FOIL STAR CAKE CASES ,1,05-12-2011 14:49,0.79,18015,United Kingdom
580678,22956,36 FOIL HEART CAKE CASES,2,05-12-2011 14:49,0.79,18015,United Kingdom
580678,22629,SPACEBOY LUNCH BOX ,1,05-12-2011 14:49,1.95,18015,United Kingdom
580678,21034,REX CASH+CARRY JUMBO SHOPPER,2,05-12-2011 14:49,0.95,18015,United Kingdom
580679,21770,OPEN CLOSED METAL SIGN,14,05-12-2011 14:49,4.95,18198,United Kingdom
580679,21718,RED METAL BEACH SPADE ,12,05-12-2011 14:49,1.25,18198,United Kingdom
580679,22114,HOT WATER BOTTLE TEA AND SYMPATHY,24,05-12-2011 14:49,3.75,18198,United Kingdom
580679,22835,HOT WATER BOTTLE I AM SO POORLY,4,05-12-2011 14:49,4.95,18198,United Kingdom
580679,22670,FRENCH WC SIGN BLUE METAL,12,05-12-2011 14:49,1.25,18198,United Kingdom
580679,84755,COLOUR GLASS T-LIGHT HOLDER HANGING,48,05-12-2011 14:49,0.65,18198,United Kingdom
580679,22916,HERB MARKER THYME,12,05-12-2011 14:49,0.65,18198,United Kingdom
580679,22919,HERB MARKER MINT,12,05-12-2011 14:49,0.65,18198,United Kingdom
580679,22917,HERB MARKER ROSEMARY,12,05-12-2011 14:49,0.65,18198,United Kingdom
580679,22920,HERB MARKER BASIL,12,05-12-2011 14:49,0.65,18198,United Kingdom
580679,22918,HERB MARKER PARSLEY,12,05-12-2011 14:49,0.65,18198,United Kingdom
580679,22921,HERB MARKER CHIVES ,12,05-12-2011 14:49,0.65,18198,United Kingdom
580679,23050,RECYCLED ACAPULCO MAT GREEN,2,05-12-2011 14:49,8.25,18198,United Kingdom
580679,22112,CHOCOLATE HOT WATER BOTTLE,3,05-12-2011 14:49,4.95,18198,United Kingdom
580680,22284,HEN HOUSE DECORATION,12,05-12-2011 14:51,1.65,13001,United Kingdom
580680,22138,BAKING SET 9 PIECE RETROSPOT ,3,05-12-2011 14:51,4.95,13001,United Kingdom
580680,84347,ROTATING SILVER ANGELS T-LIGHT HLDR,6,05-12-2011 14:51,2.55,13001,United Kingdom
580680,22178,VICTORIAN GLASS HANGING T-LIGHT,192,05-12-2011 14:51,1.65,13001,United Kingdom
580680,15056N,EDWARDIAN PARASOL NATURAL,3,05-12-2011 14:51,5.95,13001,United Kingdom
580680,22411,JUMBO SHOPPER VINTAGE RED PAISLEY,20,05-12-2011 14:51,2.08,13001,United Kingdom
580680,22386,JUMBO BAG PINK POLKADOT,10,05-12-2011 14:51,2.08,13001,United Kingdom
580680,21174,POTTERING IN THE SHED METAL SIGN,12,05-12-2011 14:51,2.08,13001,United Kingdom
580680,84988,SET OF 72 PINK HEART PAPER DOILIES,12,05-12-2011 14:51,1.45,13001,United Kingdom
580680,22224,WHITE LOVEBIRD LANTERN,6,05-12-2011 14:51,2.95,13001,United Kingdom
580680,21164,HOME SWEET HOME METAL SIGN ,6,05-12-2011 14:51,2.95,13001,United Kingdom
580680,22285,HANGING HEN ON NEST DECORATION,12,05-12-2011 14:51,1.65,13001,United Kingdom
580680,22139,RETROSPOT TEA SET CERAMIC 11 PC ,3,05-12-2011 14:51,4.95,13001,United Kingdom
580680,22619,SET OF 6 SOLDIER SKITTLES,4,05-12-2011 14:51,3.75,13001,United Kingdom
580680,84997D,CHILDRENS CUTLERY POLKADOT PINK,4,05-12-2011 14:51,4.15,13001,United Kingdom
580681,22780,LIGHT GARLAND BUTTERFILES PINK,8,05-12-2011 15:01,4.25,13083,United Kingdom
580681,22779,WOODEN OWLS LIGHT GARLAND ,8,05-12-2011 15:01,4.25,13083,United Kingdom
580681,22752,SET 7 BABUSHKA NESTING BOXES,4,05-12-2011 15:01,8.5,13083,United Kingdom
580681,21982,PACK OF 12 SUKI TISSUES ,24,05-12-2011 15:01,0.39,13083,United Kingdom
580682,21115,ROSE CARAVAN DOORSTOP,8,05-12-2011 15:02,1.95,16968,United Kingdom
580682,21285,RETROSPOT CANDLE  MEDIUM,12,05-12-2011 15:02,0.39,16968,United Kingdom
580682,21411,GINGHAM HEART  DOORSTOP RED,8,05-12-2011 15:02,1.95,16968,United Kingdom
580682,21442,GREEN BIRDHOUSE DECORATION,24,05-12-2011 15:02,0.19,16968,United Kingdom
580682,21441,BLUE BIRDHOUSE DECORATION,24,05-12-2011 15:02,0.19,16968,United Kingdom
580682,22055,MINI CAKE STAND  HANGING STRAWBERY,16,05-12-2011 15:02,0.39,16968,United Kingdom
580682,22059,CERAMIC STRAWBERRY DESIGN MUG,24,05-12-2011 15:02,0.39,16968,United Kingdom
580682,22057,CERAMIC PLATE STRAWBERRY DESIGN,16,05-12-2011 15:02,0.39,16968,United Kingdom
580682,22063,CERAMIC BOWL WITH STRAWBERRY DESIGN,18,05-12-2011 15:02,0.79,16968,United Kingdom
580682,22072,RED RETROSPOT TEA CUP AND SAUCER ,12,05-12-2011 15:02,1.25,16968,United Kingdom
580682,22220,CAKE STAND LOVEBIRD 2 TIER WHITE,6,05-12-2011 15:02,2.95,16968,United Kingdom
580682,22217,T-LIGHT HOLDER HANGING LACE,12,05-12-2011 15:02,0.39,16968,United Kingdom
580682,22464,HANGING METAL HEART LANTERN,12,05-12-2011 15:02,0.79,16968,United Kingdom
580682,22721,SET OF 3 CAKE TINS SKETCHBOOK,12,05-12-2011 15:02,1.95,16968,United Kingdom
580682,23357,HOT WATER BOTTLE SEX BOMB,12,05-12-2011 15:02,1.65,16968,United Kingdom
580682,23483,HANGING  BUTTERFLY T-LIGHT HOLDER,12,05-12-2011 15:02,1.25,16968,United Kingdom
580683,23256,CHILDRENS CUTLERY SPACEBOY ,1,05-12-2011 15:10,4.15,,United Kingdom
580683,23237,SET OF 4 KNICK KNACK TINS LEAF,1,05-12-2011 15:10,4.15,,United Kingdom
580684,23344,JUMBO BAG 50'S CHRISTMAS ,10,05-12-2011 15:15,2.08,13305,United Kingdom
580684,22144,CHRISTMAS CRAFT LITTLE FRIENDS,6,05-12-2011 15:15,2.1,13305,United Kingdom
580684,23263,SET OF 3 WOODEN HEART DECORATIONS,12,05-12-2011 15:15,1.25,13305,United Kingdom
580684,22178,VICTORIAN GLASS HANGING T-LIGHT,12,05-12-2011 15:15,1.95,13305,United Kingdom
580684,21986,PACK OF 12 PINK POLKADOT TISSUES,24,05-12-2011 15:15,0.39,13305,United Kingdom
580684,22865,HAND WARMER OWL DESIGN,24,05-12-2011 15:15,2.1,13305,United Kingdom
580684,22633,HAND WARMER UNION JACK,12,05-12-2011 15:15,2.1,13305,United Kingdom
580684,21429,RED GINGHAM ROSE JEWELLERY BOX,8,05-12-2011 15:15,1.95,13305,United Kingdom
580684,22741,FUNKY DIVA PEN,48,05-12-2011 15:15,0.85,13305,United Kingdom
580685,23681,LUNCH BAG RED VINTAGE DOILY,10,05-12-2011 15:16,1.65,17676,United Kingdom
580685,23583,LUNCH BAG PAISLEY PARK  ,10,05-12-2011 15:16,1.65,17676,United Kingdom
580685,22924,FRIDGE MAGNETS LA VIE EN ROSE,12,05-12-2011 15:16,0.85,17676,United Kingdom
580685,22923,FRIDGE MAGNETS LES ENFANTS ASSORTED,12,05-12-2011 15:16,0.85,17676,United Kingdom
580685,23207,LUNCH BAG ALPHABET DESIGN,10,05-12-2011 15:16,1.65,17676,United Kingdom
580685,23264,SET OF 3 WOODEN SLEIGH DECORATIONS,12,05-12-2011 15:16,1.25,17676,United Kingdom
580685,21877,HOME SWEET HOME MUG,12,05-12-2011 15:16,1.65,17676,United Kingdom
580685,22633,HAND WARMER UNION JACK,12,05-12-2011 15:16,2.1,17676,United Kingdom
580685,22866,HAND WARMER SCOTTY DOG DESIGN,24,05-12-2011 15:16,2.1,17676,United Kingdom
580685,22865,HAND WARMER OWL DESIGN,12,05-12-2011 15:16,2.1,17676,United Kingdom
580685,22867,HAND WARMER BIRD DESIGN,24,05-12-2011 15:16,2.1,17676,United Kingdom
580685,23204,CHARLOTTE BAG APPLES DESIGN,10,05-12-2011 15:16,0.85,17676,United Kingdom
580685,23445,ICE CREAM BUBBLES,40,05-12-2011 15:16,0.83,17676,United Kingdom
580685,23209,LUNCH BAG VINTAGE DOILY ,10,05-12-2011 15:16,1.65,17676,United Kingdom
580685,84029E,RED WOOLLY HOTTIE WHITE HEART.,4,05-12-2011 15:16,4.25,17676,United Kingdom
580685,48194,DOORMAT HEARTS,2,05-12-2011 15:16,8.25,17676,United Kingdom
C580686,22960,JAM MAKING SET WITH JARS,-1,05-12-2011 15:28,4.25,15984,United Kingdom
C580686,22963,JAM JAR WITH GREEN LID,-6,05-12-2011 15:28,0.85,15984,United Kingdom
C580686,22358,KINGS CHOICE TEA CADDY ,-1,05-12-2011 15:28,2.95,15984,United Kingdom
C580686,22488,NATURAL SLATE RECTANGLE CHALKBOARD,-1,05-12-2011 15:28,1.65,15984,United Kingdom
C580686,22842,BISCUIT TIN VINTAGE RED,-1,05-12-2011 15:28,6.75,15984,United Kingdom
580687,22553,PLASTERS IN TIN SKULLS,24,05-12-2011 15:38,1.65,16379,United Kingdom
580687,22469,HEART OF WICKER SMALL,12,05-12-2011 15:38,1.65,16379,United Kingdom
580687,84879,ASSORTED COLOUR BIRD ORNAMENT,24,05-12-2011 15:38,1.69,16379,United Kingdom
580687,21181,PLEASE ONE PERSON METAL SIGN,12,05-12-2011 15:38,2.1,16379,United Kingdom
580687,20726,LUNCH BAG WOODLAND,10,05-12-2011 15:38,1.65,16379,United Kingdom
580687,22326,ROUND SNACK BOXES SET OF4 WOODLAND ,12,05-12-2011 15:38,2.95,16379,United Kingdom
580687,22383,LUNCH BAG SUKI DESIGN ,10,05-12-2011 15:38,1.65,16379,United Kingdom
580687,23583,LUNCH BAG PAISLEY PARK  ,20,05-12-2011 15:38,1.65,16379,United Kingdom
580687,23209,LUNCH BAG VINTAGE DOILY ,20,05-12-2011 15:38,1.65,16379,United Kingdom
580687,23208,LUNCH BAG VINTAGE LEAF DESIGN,10,05-12-2011 15:38,1.65,16379,United Kingdom
580687,22993,SET OF 4 PANTRY JELLY MOULDS,12,05-12-2011 15:38,1.25,16379,United Kingdom
580687,23503,PLAYING CARDS KEEP CALM & CARRY ON,12,05-12-2011 15:38,1.25,16379,United Kingdom
580687,22721,SET OF 3 CAKE TINS SKETCHBOOK,12,05-12-2011 15:38,1.95,16379,United Kingdom
580687,23552,BICYCLE PUNCTURE REPAIR KIT ,6,05-12-2011 15:38,2.08,16379,United Kingdom
580687,23240,SET OF 4 KNICK KNACK TINS DOILY ,6,05-12-2011 15:38,4.15,16379,United Kingdom
580693,22228,BUNNY WOODEN PAINTED WITH BIRD ,12,05-12-2011 15:59,0.39,15690,United Kingdom
580693,22267,EASTER DECORATION EGG BUNNY ,48,05-12-2011 15:59,0.39,15690,United Kingdom
580693,23148,MINIATURE ANTIQUE ROSE HOOK IVORY,12,05-12-2011 15:59,0.83,15690,United Kingdom
580693,35967,FOLK ART METAL STAR T-LIGHT HOLDER,12,05-12-2011 15:59,0.85,15690,United Kingdom
580693,22076,6 RIBBONS EMPIRE  ,24,05-12-2011 15:59,0.39,15690,United Kingdom
580693,22219,LOVEBIRD HANGING DECORATION WHITE ,12,05-12-2011 15:59,0.85,15690,United Kingdom
580693,23275,SET OF 3 HANGING OWLS OLLIE BEAK,12,05-12-2011 15:59,1.25,15690,United Kingdom
580693,85203,HANGING WOOD AND FELT BUTTERFLY ,24,05-12-2011 15:59,0.42,15690,United Kingdom
580693,22227,HANGING HEART MIRROR DECORATION ,24,05-12-2011 15:59,0.65,15690,United Kingdom
580693,23473,WOODLAND SMALL RED FELT HEART,12,05-12-2011 15:59,0.83,15690,United Kingdom
580693,85131D,BEADED CRYSTAL HEART PINK ON STICK,12,05-12-2011 15:59,1.25,15690,United Kingdom
580694,84884A,ANT WHITE WIRE HEART SPIRAL,10,05-12-2011 16:00,1.95,16600,United Kingdom
580694,21498,RED RETROSPOT WRAP ,25,05-12-2011 16:00,0.42,16600,United Kingdom
580694,22072,RED RETROSPOT TEA CUP AND SAUCER ,12,05-12-2011 16:00,1.25,16600,United Kingdom
580694,20992,JAZZ HEARTS PURSE NOTEBOOK,24,05-12-2011 16:00,0.39,16600,United Kingdom
580694,22577,WOODEN HEART CHRISTMAS SCANDINAVIAN,24,05-12-2011 16:00,0.29,16600,United Kingdom
580694,85034B,3 WHITE CHOC MORRIS BOXED CANDLES,12,05-12-2011 16:00,1.25,16600,United Kingdom
580694,21462,"NURSERY A,B,C PAINTED LETTERS",8,05-12-2011 16:00,1.95,16600,United Kingdom
580694,21411,GINGHAM HEART  DOORSTOP RED,8,05-12-2011 16:00,1.95,16600,United Kingdom
580694,22065,CHRISTMAS PUDDING TRINKET POT ,48,05-12-2011 16:00,0.39,16600,United Kingdom
580694,22220,CAKE STAND LOVEBIRD 2 TIER WHITE,6,05-12-2011 16:00,2.95,16600,United Kingdom
580694,22509,SEWING BOX RETROSPOT DESIGN ,4,05-12-2011 16:00,3.95,16600,United Kingdom
580694,22075,6 RIBBONS ELEGANT CHRISTMAS ,24,05-12-2011 16:00,0.39,16600,United Kingdom
580694,22076,6 RIBBONS EMPIRE  ,24,05-12-2011 16:00,0.39,16600,United Kingdom
580694,22217,T-LIGHT HOLDER HANGING LACE,12,05-12-2011 16:00,0.39,16600,United Kingdom
580694,22758,LARGE PURPLE BABUSHKA NOTEBOOK  ,12,05-12-2011 16:00,0.39,16600,United Kingdom
580694,23322,LARGE WHITE HEART OF WICKER,6,05-12-2011 16:00,2.95,16600,United Kingdom
580694,23321,SMALL WHITE HEART OF WICKER,12,05-12-2011 16:00,1.65,16600,United Kingdom
580694,20972,PINK CREAM FELT CRAFT TRINKET BOX ,12,05-12-2011 16:00,1.25,16600,United Kingdom
580695,35004G,SET OF 3 GOLD FLYING DUCKS,1,05-12-2011 16:03,1.95,13230,United Kingdom
580695,22721,SET OF 3 CAKE TINS SKETCHBOOK,1,05-12-2011 16:03,1.95,13230,United Kingdom
580695,22500,SET OF 2 TINS JARDIN DE PROVENCE,1,05-12-2011 16:03,1.25,13230,United Kingdom
580695,23570,TRADITIONAL PICK UP STICKS GAME ,1,05-12-2011 16:03,1.25,13230,United Kingdom
580695,23035,DRAWER KNOB CERAMIC IVORY,6,05-12-2011 16:03,1.45,13230,United Kingdom
580695,21668,RED STRIPE CERAMIC DRAWER KNOB,6,05-12-2011 16:03,1.45,13230,United Kingdom
580695,22974,CHILDRENS DOLLY GIRL MUG,1,05-12-2011 16:03,1.65,13230,United Kingdom
580695,22301,COFFEE MUG CAT + BIRD DESIGN,2,05-12-2011 16:03,2.55,13230,United Kingdom
580695,22970,LONDON BUS COFFEE MUG,1,05-12-2011 16:03,2.55,13230,United Kingdom
580695,22971,QUEENS GUARD COFFEE MUG,1,05-12-2011 16:03,2.55,13230,United Kingdom
580695,22972,CHILDREN'S SPACEBOY MUG,1,05-12-2011 16:03,1.65,13230,United Kingdom
580695,22975,SPACEBOY CHILDRENS EGG CUP,1,05-12-2011 16:03,1.25,13230,United Kingdom
580695,22977,DOLLY GIRL CHILDRENS EGG CUP,1,05-12-2011 16:03,1.25,13230,United Kingdom
580695,22988,SOLDIERS EGG CUP ,2,05-12-2011 16:03,1.25,13230,United Kingdom
580695,22139,RETROSPOT TEA SET CERAMIC 11 PC ,1,05-12-2011 16:03,4.95,13230,United Kingdom
580695,22467,GUMBALL COAT RACK,1,05-12-2011 16:03,2.55,13230,United Kingdom
580695,23323,WHITE WICKER STAR ,1,05-12-2011 16:03,2.1,13230,United Kingdom
580695,23321,SMALL WHITE HEART OF WICKER,2,05-12-2011 16:03,1.65,13230,United Kingdom
580695,23263,SET OF 3 WOODEN HEART DECORATIONS,2,05-12-2011 16:03,1.25,13230,United Kingdom
580695,23331,DECORATIVE WICKER HEART SMALL,2,05-12-2011 16:03,0.63,13230,United Kingdom
580695,23334,IVORY WICKER HEART SMALL,2,05-12-2011 16:03,0.63,13230,United Kingdom
580695,23330,DECORATIVE WICKER HEART MEDIUM,2,05-12-2011 16:03,1.25,13230,United Kingdom
580695,23333,IVORY WICKER HEART MEDIUM,2,05-12-2011 16:03,1.25,13230,United Kingdom
580695,23332,IVORY WICKER HEART LARGE,2,05-12-2011 16:03,1.65,13230,United Kingdom
580695,21810,CHRISTMAS HANGING STAR WITH BELL,2,05-12-2011 16:03,0.39,13230,United Kingdom
580695,22575,METAL MERRY CHRISTMAS WREATH,1,05-12-2011 16:03,1.95,13230,United Kingdom
580695,22430,ENAMEL WATERING CAN CREAM,1,05-12-2011 16:03,4.95,13230,United Kingdom
580695,23265,SET OF 3 WOODEN TREE DECORATIONS,1,05-12-2011 16:03,1.25,13230,United Kingdom
580695,21810,CHRISTMAS HANGING STAR WITH BELL,3,05-12-2011 16:03,0.39,13230,United Kingdom
580695,23313,VINTAGE CHRISTMAS BUNTING,2,05-12-2011 16:03,4.95,13230,United Kingdom
580695,22910,PAPER CHAIN KIT VINTAGE CHRISTMAS,1,05-12-2011 16:03,2.95,13230,United Kingdom
580695,23031,DRAWER KNOB CRACKLE GLAZE PINK,2,05-12-2011 16:03,1.65,13230,United Kingdom
580695,22072,RED RETROSPOT TEA CUP AND SAUCER ,1,05-12-2011 16:03,1.25,13230,United Kingdom
580695,22721,SET OF 3 CAKE TINS SKETCHBOOK,1,05-12-2011 16:03,1.95,13230,United Kingdom
580695,21446,12 RED ROSE PEG PLACE SETTINGS,2,05-12-2011 16:03,1.25,13230,United Kingdom
580695,22465,HANGING METAL STAR LANTERN,2,05-12-2011 16:03,0.79,13230,United Kingdom
580695,22464,HANGING METAL HEART LANTERN,2,05-12-2011 16:03,0.79,13230,United Kingdom
580695,22195,LARGE HEART MEASURING SPOONS,1,05-12-2011 16:03,1.65,13230,United Kingdom
580695,21446,12 RED ROSE PEG PLACE SETTINGS,1,05-12-2011 16:03,1.25,13230,United Kingdom
580695,23343,JUMBO BAG VINTAGE CHRISTMAS ,2,05-12-2011 16:03,2.08,13230,United Kingdom
580695,23344,JUMBO BAG 50'S CHRISTMAS ,2,05-12-2011 16:03,2.08,13230,United Kingdom
580695,22195,LARGE HEART MEASURING SPOONS,2,05-12-2011 16:03,1.65,13230,United Kingdom
580695,84819,DANISH ROSE ROUND SEWING BOX,1,05-12-2011 16:03,0.79,13230,United Kingdom
580695,23264,SET OF 3 WOODEN SLEIGH DECORATIONS,1,05-12-2011 16:03,1.25,13230,United Kingdom
580695,23266,SET OF 3 WOODEN STOCKING DECORATION,1,05-12-2011 16:03,1.25,13230,United Kingdom
580695,22732,3D VINTAGE CHRISTMAS STICKERS ,3,05-12-2011 16:03,1.25,13230,United Kingdom
580695,23570,TRADITIONAL PICK UP STICKS GAME ,1,05-12-2011 16:03,1.25,13230,United Kingdom
580695,21264,WHITE GOOSE FEATHER TREE 60CM ,2,05-12-2011 16:03,1.95,13230,United Kingdom
580695,22942,CHRISTMAS LIGHTS 10 SANTAS ,1,05-12-2011 16:03,2.95,13230,United Kingdom
580695,21263,GREEN GOOSE FEATHER TREE 60CM,2,05-12-2011 16:03,1.95,13230,United Kingdom
580695,23349,ROLL WRAP VINTAGE CHRISTMAS,3,05-12-2011 16:03,1.25,13230,United Kingdom
580695,23352,ROLL WRAP 50'S RED CHRISTMAS ,2,05-12-2011 16:03,1.25,13230,United Kingdom
580695,23351,ROLL WRAP 50'S CHRISTMAS,2,05-12-2011 16:03,1.25,13230,United Kingdom
580695,22076,6 RIBBONS EMPIRE  ,2,05-12-2011 16:03,0.39,13230,United Kingdom
580695,22075,6 RIBBONS ELEGANT CHRISTMAS ,2,05-12-2011 16:03,0.39,13230,United Kingdom
580695,23350,ROLL WRAP VINTAGE SPOT ,3,05-12-2011 16:03,1.25,13230,United Kingdom
580695,84509G,SET OF 4 FAIRY CAKE PLACEMATS ,2,05-12-2011 16:03,1.25,13230,United Kingdom
580695,22701,PINK DOG BOWL,1,05-12-2011 16:03,0.79,13230,United Kingdom
580695,22349,DOG BOWL CHASING BALL DESIGN,1,05-12-2011 16:03,3.75,13230,United Kingdom
580695,21034,REX CASH+CARRY JUMBO SHOPPER,1,05-12-2011 16:03,0.95,13230,United Kingdom
580695,22196,SMALL HEART MEASURING SPOONS,3,05-12-2011 16:03,0.85,13230,United Kingdom
580695,22703,PINK CAT BOWL,1,05-12-2011 16:03,0.59,13230,United Kingdom
580695,22350,ILLUSTRATED CAT BOWL ,1,05-12-2011 16:03,2.55,13230,United Kingdom
580695,22215,CAKE STAND WHITE TWO TIER LACE,1,05-12-2011 16:03,2.95,13230,United Kingdom
580695,23322,LARGE WHITE HEART OF WICKER,3,05-12-2011 16:03,2.95,13230,United Kingdom
580695,23323,WHITE WICKER STAR ,1,05-12-2011 16:03,2.1,13230,United Kingdom
580695,23143,ZINC WIRE KITCHEN ORGANISER,1,05-12-2011 16:03,3.95,13230,United Kingdom
580695,17003,BROCADE RING PURSE ,12,05-12-2011 16:03,0.39,13230,United Kingdom
580695,22423,REGENCY CAKESTAND 3 TIER,1,05-12-2011 16:03,12.75,13230,United Kingdom
580695,22173,METAL 4 HOOK HANGER FRENCH CHATEAU,1,05-12-2011 16:03,3.29,13230,United Kingdom
580695,21109,LARGE CAKE TOWEL CHOCOLATE SPOTS,1,05-12-2011 16:03,1.95,13230,United Kingdom
580695,22072,RED RETROSPOT TEA CUP AND SAUCER ,1,05-12-2011 16:03,1.25,13230,United Kingdom
580695,21730,GLASS STAR FROSTED T-LIGHT HOLDER,3,05-12-2011 16:03,4.95,13230,United Kingdom
580695,22644,CERAMIC CHERRY CAKE MONEY BANK,2,05-12-2011 16:03,0.39,13230,United Kingdom
580695,22645,CERAMIC HEART FAIRY CAKE MONEY BANK,2,05-12-2011 16:03,0.39,13230,United Kingdom
580695,71477,COLOURED GLASS STAR T-LIGHT HOLDER,4,05-12-2011 16:03,3.95,13230,United Kingdom
580695,21733,RED HANGING HEART T-LIGHT HOLDER,4,05-12-2011 16:03,2.95,13230,United Kingdom
580695,85123A,WHITE HANGING HEART T-LIGHT HOLDER,4,05-12-2011 16:03,2.95,13230,United Kingdom
580695,15044A,PINK PAPER PARASOL ,1,05-12-2011 16:03,2.95,13230,United Kingdom
580695,84945,MULTI COLOUR SILVER T-LIGHT HOLDER,12,05-12-2011 16:03,0.85,13230,United Kingdom
580695,82484,WOOD BLACK BOARD ANT WHITE FINISH,4,05-12-2011 16:03,7.95,13230,United Kingdom
